{
  "schema_version": "1.0.0",
  "run_id": "20260812T033049095Z-083acb4-PR_DELTA-c1485b",
  "baseline_run_id": "20260810T214356000Z-ee496aa-PR_DELTA-e7ff26",
  "generated_at": "2026-08-12T03:35:00.000Z",
  "verdict": "PASS",
  "summary": {
    "results": {
      "PASS": 19,
      "NOT_APPLICABLE": 23,
      "FAIL": 2,
      "UNVERIFIED": 2
    },
    "result_transitions": {
      "UNCHANGED": 46
    },
    "coverage_transitions": {
      "UNCHANGED": 46
    },
    "finding_statuses": {
      "OPEN": 2
    },
    "surface_readiness": {
      "IMPLEMENTED": 14
    },
    "readiness_transitions": {
      "UNCHANGED": 14
    }
  },
  "observations": [
    {
      "observation_key": "projsayre/sayre|CORE-01|tenant-isolation|chatStore-org-id-injection|v1",
      "check_id": "CORE-01",
      "surface_id": "tenant-isolation",
      "surface_readiness": "IMPLEMENTED",
      "target_asset": "chatStore-org-id-injection (chat_conversations / chat_turns RLS + composite-FK tenant binding)",
      "attack_path_version": "v1",
      "attempt": "Verify the ripple-rebase renumber (drizzle/0020_ch03_chat_conversations_and_turns.sql -> 0021_..., _journal.json idx 20->21 / when 1785384400000->1785384500000) did not alter, weaken, or desynchronize the org_id-stamping/RLS/composite-FK DDL, and did not introduce a journal-ordering defect (duplicate idx, out-of-order 'when') that could cause the migration to silently fail to register or apply out of order relative to CH-01's migration.",
      "evidence": [
        "THIS RUN, fresh: Migration content identity -- git diff 25f60fa:services/core/drizzle/0020_ch03_chat_conversations_and_turns.sql 083acb4:services/core/drizzle/0021_ch03_chat_conversations_and_turns.sql is empty. The RLS ENABLE/FORCE, org_isolation policy, composite FOREIGN KEY (org_id, conversation_id)/(org_id, user_id), CHECK constraints, partial unique indexes, and GRANT statements are byte-for-byte the exact content dynamically verified in baseline run 20260810T214356000Z-ee496aa-PR_DELTA-e7ff26 (commit ee496aa4985fc4145afbadf34c54de9cf3e9910a): 11/11 chatStore.rls.test.ts cases passing against a real Postgres container, including a real cross-org and a real same-org-different-user rejection.",
        "THIS RUN, fresh: _journal.json diffed directly -- idx 21/when 1785384500000/tag 0021_ch03_chat_conversations_and_turns immediately follows CH-01's idx 20/when 1785384400000 (strictly greater, so journal order agrees with drizzle apply order); journal-wide idx set (0..21) re-confirmed unique via chatMigration.test.ts's own new Set(entries.map(idx)).size === entries.length assertion, re-run green this session.",
        "THIS RUN, fresh: chatMigration.test.ts (structural CI-safe assertions over the renumbered SQL: CREATE TABLE, RLS ENABLE+FORCE, org_isolation policy text, composite FOREIGN KEY text, GRANT SELECT/INSERT/UPDATE-never-DELETE, CHECK constraints) re-run directly this session: 7/7 pass.",
        "THIS RUN, fresh: services/core/src/db/rls_acceptance.tester.test.ts (W0-05's independent, separately-authored 14-table RLS acceptance suite) re-confirmed via git diff e04d7cbcfe0f7b0aa318a5909f5bf75dc80c925d 083acb4 -- services/core/src/db/rls_acceptance.tester.test.ts: empty. The prior ruling that chat_* tables are deliberately outside this suite's pinned 14-table set (separately covered by chatMigration.test.ts/chatStore.rls.test.ts) is unchanged by this hop -- the pin was neither silently widened nor narrowed.",
        "THIS RUN, fresh: services/core/src/db/schema.ts's Drizzle table definitions (chatConversations/chatTurns column shapes, the two composite foreignKey() calls, the two unique() calls) diffed directly against the pre-rebase tip: the only change anywhere in the file is one doc-comment line citing the new migration filename (0020_ch03... -> 0021_ch03...); every column/constraint/index definition is byte-identical.",
        "METHODOLOGY NOTE (read before relying on this PASS): this run gathered NO fresh DYNAMIC evidence for the live RLS/composite-FK/cross-org-rejection behavior -- chatStore.rls.test.ts (the live-Postgres suite) was not executed this session. Every credential-adjacent path needed to run it was denied by this session's own permission classifier; reproduced directly and independently: `docker exec sayre-postgres env` returned \"Permission for this action was denied by the Claude Code auto mode classifier. Reason: Blocked by classifier.\" This PASS instead rests on: (a) cryptographic proof the DDL is byte-identical to content that WAS dynamically verified in baseline run 20260810T214356000Z-ee496aa-PR_DELTA-e7ff26, (b) fresh static re-confirmation of journal ordering/idx-uniqueness/structural-assertion integrity (the two properties a renumbering specifically could plausibly have broken), and (c) the independent, separately-reasoning review stage (.pipeline/review.md) reaching the same conclusion via its own from-scratch verification. This chain is judged sufficient for a pure rename+renumber with a proven-empty content diff. It is NOT a license for any future hop: the moment migration/RLS/schema content actually changes (not merely renumbers), fresh DYNAMIC re-verification against a real Postgres is mandatory again and this reasoning may not be reused. Tracked as a standing, carried-forward pre-merge obligation (matches review.md Warning W-2) in this report's Limitations section, not silently closed."
      ],
      "evidence_type": "STATIC",
      "result": "PASS",
      "previous_result": "PASS",
      "result_transition": "UNCHANGED",
      "coverage_transition": "UNCHANGED",
      "severity": "NONE",
      "confidence": "MEDIUM",
      "single_point_of_failure": false,
      "finding": null,
      "reproduction_and_cleanup": "Static: git diff (blob-to-blob and commit-to-commit) over the migration SQL, _journal.json, schema.ts, rls_acceptance.tester.test.ts; npx vitest run services/core/src/db/chatMigration.test.ts (7/7 pass). Dynamic: none this run (see methodology note); baseline's dynamic run (11/11, real Postgres, dropped throwaway DB after) is the most recent dynamic evidence on record for this exact DDL. No fixture created or left behind this run.",
      "code_references": [
        "services/core/drizzle/0021_ch03_chat_conversations_and_turns.sql",
        "services/core/drizzle/meta/_journal.json:141-160",
        "services/core/src/db/chatMigration.test.ts",
        "services/core/src/db/schema.ts:777-878",
        "services/core/src/db/rls_acceptance.tester.test.ts"
      ]
    },
    {
      "observation_key": "projsayre/sayre|CORE-02|rbac-boundary|chat-graph-traversal|v1",
      "check_id": "CORE-02",
      "surface_id": "rbac-boundary",
      "surface_readiness": "ABSENT",
      "target_asset": "chat conversation/turn persistence (no graph traversal in this diff)",
      "attack_path_version": "v1",
      "attempt": "Searched every new/changed file for a Graph Query Service call, Cypher construction, node-level RBAC filter, or client-side graphology usage.",
      "evidence": [
        "[HOP-CARRY-FORWARD, re-gate run 20260812T033049095Z-083acb4-PR_DELTA-c1485b] Target asset code is confirmed byte-identical across the CH-03 ripple-rebase/renumber hop (old CH-03 tip 25f60fa -> new CH-03 tip 083acb4): git diff 25f60fa 083acb4 -- <target files> returns zero lines for every file this check depends on (independently re-verified this run, not merely asserted). No code this observation depends on changed; baseline run evidence and result are re-affirmed on the current, confirmed-identical artifact.",
        "grep across all 8 new files + the 15 modified files for 'neo4j-driver', 'graph-query', 'graphology', 'Cypher' returns no hits",
        "services/core/.eslintrc.json's src/routes/** override structurally forbids importing **/graph-query/* from routes; `npx eslint . --ext .ts` in services/core exits 0 with zero warnings"
      ],
      "evidence_type": "STATIC",
      "result": "NOT_APPLICABLE",
      "previous_result": "NOT_APPLICABLE",
      "result_transition": "UNCHANGED",
      "coverage_transition": "UNCHANGED",
      "severity": "NONE",
      "confidence": "HIGH",
      "single_point_of_failure": false,
      "finding": null,
      "reproduction_and_cleanup": "Static grep only; no fixture created.",
      "code_references": []
    },
    {
      "observation_key": "projsayre/sayre|CORE-03|secret-handling|chat-turns-producer-secrets|v1",
      "check_id": "CORE-03",
      "surface_id": "secret-handling",
      "surface_readiness": "IMPLEMENTED",
      "target_asset": "services/core/src/queue/sqs.ts publishChatTurnRequest + chatService.ts mcpCredential pinning",
      "attack_path_version": "v1",
      "attempt": "Grepped every new/changed file for a hardcoded credential; ran the repo's automated secret-access gates; then dynamically published a real ChatTurnRequestPayload envelope to the local LocalStack chat-turns.fifo queue and received it back to confirm the on-wire `mcpCredential` value and full key set.",
      "evidence": [